{
  "recipe_metadata": {
    "recipe_id": "01-12-DOCUMENTATION-HANDOVER-COMPREHENSIVE",
    "title": "Documentation and Handover - Complete Implementation",
    "version": "5.0.0",
    "created_by": "Claude Sonnet 4",
    "creation_date": "2025-07-05T18:02:45Z",
    "last_updated": "2025-07-05T18:02:45Z",
    "estimated_tokens": 40000,
    "estimated_execution_time": "2-3 hours",
    "difficulty_level": "intermediate",
    "total_tasks": 6,
    "agent_autonomy_level": "95%",
    "success_rate_target": "99%",
    "compliance_standards": [
      "ISO 27001",
      "SOC 2"
    ],
    "architecture_tier": "enterprise-documentation",
    "description": "Complete documentation and handover implementation with system documentation, user guides, and handover procedures",
    "is_master_recipe": false,
    "dependencies": {
      "prerequisites": [
        "01-01-docker-environment",
        "01-02-system-monitoring",
        "01-03-logging-infrastructure",
        "01-04-load-balancing",
        "01-05-service-discovery",
        "01-06-message-queue",
        "01-07-cache-layer",
        "01-08-backup-infrastructure",
        "01-09-security-hardening",
        "01-10-performance-optimization",
        "01-11-disaster-recovery"
      ],
      "required_services": [
        "docker",
        "documentation"
      ],
      "required_networks": [
        "ai-q-network",
        "ai-q-services"
      ],
      "required_volumes": [
        "ai-q-data",
        "ai-q-docs"
      ],
      "required_ports": [],
      "required_files": [
        "/opt/ai-q/documentation/"
      ]
    },
    "kitchen_system": {
      "pantry_category": "documentation",
      "cooking_time": "180 minutes",
      "complexity": "intermediate",
      "kitchen_tools": [
        "system_documentation",
        "user_guides",
        "handover_procedures"
      ],
      "cache_strategy": "documentation_cache",
      "orchestrator_priority": "standard"
    }
  },
  "prerequisites": {
    "completed_tasks": [
      "01-01-01: Docker Engine installed",
      "01-01-02: Docker daemon configured",
      "01-01-03: Docker networks created",
      "01-02-01: Prometheus installed",
      "01-02-02: Node Exporter running",
      "01-02-03: Alert Manager configured",
      "01-02-04: Grafana installed",
      "01-03-01: Elasticsearch installed",
      "01-03-02: Logstash configured",
      "01-03-03: Kibana installed",
      "01-04-01: Nginx installed",
      "01-05-01: Consul server installed",
      "01-06-01: RabbitMQ server installed",
      "01-07-01: Redis server installed",
      "01-08-01: Backup scripts created",
      "01-09-01: Firewall configured",
      "01-10-01: Resource limits configured",
      "01-11-01: DR plan created"
    ],
    "system_requirements": {
      "cpu": "Minimum 1 core for documentation",
      "ram": "Minimum 2GB for documentation",
      "storage": "Minimum 10GB for documentation",
      "network": "Access to all service networks"
    }
  },
  "task_01_create_system_documentation": {
    "task_id": "01-12-01",
    "title": "Create System Documentation",
    "description": "Create comprehensive system documentation",
    "estimated_duration": "60 minutes",
    "critical": true,
    "steps": [
      {
        "step_id": "01-12-01-01",
        "title": "Create system overview documentation",
        "description": "Create comprehensive system overview documentation",
        "config_file": "/opt/ai-q/documentation/system-overview.json",
        "config_content": {
          "system_overview": {
            "title": "AI-Q System Overview",
            "version": "1.0.0",
            "description": "Comprehensive infrastructure platform built with modern technologies and best practices for scalability, reliability, and maintainability",
            "core_components": {
              "docker_environment": {
                "description": "Containerized services for isolation and portability",
                "features": [
                  "Docker Compose orchestration",
                  "Custom networks for service communication",
                  "Volume management"
                ]
              },
              "monitoring_stack": {
                "description": "Comprehensive monitoring and alerting",
                "features": [
                  "Prometheus metrics collection",
                  "Grafana visualization",
                  "Alert Manager notifications",
                  "Node Exporter system metrics"
                ]
              },
              "logging_infrastructure": {
                "description": "Centralized logging and analysis",
                "features": [
                  "Elasticsearch log storage",
                  "Logstash log processing",
                  "Kibana log visualization"
                ]
              },
              "load_balancing": {
                "description": "HTTP load balancing and SSL termination",
                "features": [
                  "Nginx load balancer",
                  "Health checks and failover",
                  "SSL termination"
                ]
              },
              "service_discovery": {
                "description": "Service registration and discovery",
                "features": [
                  "Consul service registry",
                  "Health checking",
                  "Key-value storage"
                ]
              },
              "message_queue": {
                "description": "Message queuing and processing",
                "features": [
                  "RabbitMQ message broker",
                  "Management interface",
                  "Clustering support"
                ]
              },
              "cache_layer": {
                "description": "Distributed caching and session storage",
                "features": [
                  "Redis caching",
                  "Session storage",
                  "Data persistence"
                ]
              },
              "backup_infrastructure": {
                "description": "Automated backup and recovery",
                "features": [
                  "Automated backup scripts",
                  "Versioning and retention",
                  "Recovery procedures"
                ]
              },
              "security_hardening": {
                "description": "Security and compliance measures",
                "features": [
                  "Firewall configuration",
                  "Access controls",
                  "Compliance monitoring"
                ]
              },
              "performance_optimization": {
                "description": "System optimization and tuning",
                "features": [
                  "Resource limits",
                  "System tuning",
                  "Performance monitoring"
                ]
              },
              "disaster_recovery": {
                "description": "Business continuity and recovery",
                "features": [
                  "Recovery procedures",
                  "Failover systems",
                  "Business continuity"
                ]
              }
            }
          },
          "system_requirements": {
            "cpu": "Minimum 4 cores",
            "ram": "Minimum 8GB",
            "storage": "Minimum 200GB",
            "network": "Stable internet connection"
          },
          "service_ports": {
            "ssh": 22,
            "http": 80,
            "https": 443,
            "prometheus": 9090,
            "grafana": 3000,
            "kibana": 5601,
            "consul": 8500,
            "rabbitmq_management": 15672,
            "redis": 6379,
            "postgresql": 5432
          },
          "configuration_structure": {
            "base_path": "/opt/ai-q/",
            "directories": {
              "docker": [
                "compose",
                "config"
              ],
              "monitoring": [],
              "logging": [],
              "backup": [],
              "security": [],
              "performance": [],
              "disaster_recovery": [],
              "documentation": []
            }
          },
          "maintenance_procedures": {
            "daily_tasks": [
              "Monitor system health",
              "Check backup status",
              "Review security logs"
            ],
            "weekly_tasks": [
              "Update system packages",
              "Review performance metrics",
              "Test backup recovery"
            ],
            "monthly_tasks": [
              "Security audit",
              "Performance optimization",
              "Documentation updates"
            ]
          },
          "support_information": {
            "troubleshooting": "Common issues and solutions are documented in the troubleshooting guide",
            "contact": "For support and maintenance, contact the system administrator"
          }
        },
        "commands": [
          "sudo mkdir -p /opt/ai-q/documentation",
          "sudo tee /opt/ai-q/documentation/system-overview.json << 'EOF'\n{\n  \"system_overview\": {\n    \"title\": \"AI-Q System Overview\",\n    \"version\": \"1.0.0\",\n    \"description\": \"Comprehensive infrastructure platform built with modern technologies and best practices for scalability, reliability, and maintainability\",\n    \"core_components\": {\n      \"docker_environment\": {\n        \"description\": \"Containerized services for isolation and portability\",\n        \"features\": [\"Docker Compose orchestration\", \"Custom networks for service communication\", \"Volume management\"]\n      },\n      \"monitoring_stack\": {\n        \"description\": \"Comprehensive monitoring and alerting\",\n        \"features\": [\"Prometheus metrics collection\", \"Grafana visualization\", \"Alert Manager notifications\", \"Node Exporter system metrics\"]\n      },\n      \"logging_infrastructure\": {\n        \"description\": \"Centralized logging and analysis\",\n        \"features\": [\"Elasticsearch log storage\", \"Logstash log processing\", \"Kibana log visualization\"]\n      },\n      \"load_balancing\": {\n        \"description\": \"HTTP load balancing and SSL termination\",\n        \"features\": [\"Nginx load balancer\", \"Health checks and failover\", \"SSL termination\"]\n      },\n      \"service_discovery\": {\n        \"description\": \"Service registration and discovery\",\n        \"features\": [\"Consul service registry\", \"Health checking\", \"Key-value storage\"]\n      },\n      \"message_queue\": {\n        \"description\": \"Message queuing and processing\",\n        \"features\": [\"RabbitMQ message broker\", \"Management interface\", \"Clustering support\"]\n      },\n      \"cache_layer\": {\n        \"description\": \"Distributed caching and session storage\",\n        \"features\": [\"Redis caching\", \"Session storage\", \"Data persistence\"]\n      },\n      \"backup_infrastructure\": {\n        \"description\": \"Automated backup and recovery\",\n        \"features\": [\"Automated backup scripts\", \"Versioning and retention\", \"Recovery procedures\"]\n      },\n      \"security_hardening\": {\n        \"description\": \"Security and compliance measures\",\n        \"features\": [\"Firewall configuration\", \"Access controls\", \"Compliance monitoring\"]\n      },\n      \"performance_optimization\": {\n        \"description\": \"System optimization and tuning\",\n        \"features\": [\"Resource limits\", \"System tuning\", \"Performance monitoring\"]\n      },\n      \"disaster_recovery\": {\n        \"description\": \"Business continuity and recovery\",\n        \"features\": [\"Recovery procedures\", \"Failover systems\", \"Business continuity\"]\n      }\n    }\n  },\n  \"system_requirements\": {\n    \"cpu\": \"Minimum 4 cores\",\n    \"ram\": \"Minimum 8GB\",\n    \"storage\": \"Minimum 200GB\",\n    \"network\": \"Stable internet connection\"\n  },\n  \"service_ports\": {\n    \"ssh\": 22,\n    \"http\": 80,\n    \"https\": 443,\n    \"prometheus\": 9090,\n    \"grafana\": 3000,\n    \"kibana\": 5601,\n    \"consul\": 8500,\n    \"rabbitmq_management\": 15672,\n    \"redis\": 6379,\n    \"postgresql\": 5432\n  },\n  \"configuration_structure\": {\n    \"base_path\": \"/opt/ai-q/\",\n    \"directories\": {\n      \"docker\": [\"compose\", \"config\"],\n      \"monitoring\": [],\n      \"logging\": [],\n      \"backup\": [],\n      \"security\": [],\n      \"performance\": [],\n      \"disaster_recovery\": [],\n      \"documentation\": []\n    }\n  },\n  \"maintenance_procedures\": {\n    \"daily_tasks\": [\n      \"Monitor system health\",\n      \"Check backup status\",\n      \"Review security logs\"\n    ],\n    \"weekly_tasks\": [\n      \"Update system packages\",\n      \"Review performance metrics\",\n      \"Test backup recovery\"\n    ],\n    \"monthly_tasks\": [\n      \"Security audit\",\n      \"Performance optimization\",\n      \"Documentation updates\"\n    ]\n  },\n  \"support_information\": {\n    \"troubleshooting\": \"Common issues and solutions are documented in the troubleshooting guide\",\n    \"contact\": \"For support and maintenance, contact the system administrator\"\n  }\n}\nEOF"
        ],
        "verification": "Check system documentation exists",
        "expected_output": "system-overview.json created with comprehensive documentation"
      }
    ],
    "verification_commands": [
      "ls -la /opt/ai-q/documentation/",
      "cat /opt/ai-q/documentation/system-overview.json"
    ],
    "expected_outputs": {
      "system_docs": "system-overview.json contains comprehensive system documentation"
    }
  },
  "task_02_create_user_guides": {
    "task_id": "01-12-02",
    "title": "Create User Guides",
    "description": "Create user guides for system administration",
    "estimated_duration": "45 minutes",
    "critical": true,
    "steps": [
      {
        "step_id": "01-12-02-01",
        "title": "Create administration guide",
        "description": "Create comprehensive administration guide",
        "config_file": "/opt/ai-q/documentation/administration-guide.json",
        "config_content": {
          "administration_guide": {
            "title": "AI-Q Administration Guide",
            "version": "1.0.0",
            "quick_start": {
              "system_status_check": {
                "description": "Check system health and service status",
                "commands": [
                  "docker ps",
                  "curl http://localhost:8500/v1/status/leader",
                  "curl http://localhost:9090/-/healthy"
                ]
              },
              "service_management": {
                "description": "Manage system services",
                "commands": {
                  "start_all_services": "docker-compose -f /opt/ai-q/docker/compose/ai-q-stack.yml up -d",
                  "stop_all_services": "docker-compose -f /opt/ai-q/docker/compose/ai-q-stack.yml down",
                  "restart_specific_service": "docker restart ai-q-postgresql"
                }
              },
              "backup_operations": {
                "description": "Backup and recovery operations",
                "commands": {
                  "create_backup": "/opt/ai-q/backup/scripts/backup-all.sh",
                  "list_backups": "ls -la /opt/ai-q/backup/data/",
                  "restore_backup": "/opt/ai-q/backup/scripts/recover-all.sh <backup-name>"
                }
              },
              "monitoring_access": {
                "description": "Access monitoring interfaces",
                "urls": {
                  "grafana": "http://localhost:3000",
                  "prometheus": "http://localhost:9090",
                  "kibana": "http://localhost:5601",
                  "consul": "http://localhost:8500",
                  "rabbitmq": "http://localhost:15672"
                }
              }
            },
            "common_operations": {
              "adding_new_service": {
                "description": "Add new service to the system",
                "steps": [
                  "Create Docker Compose service definition",
                  "Add to monitoring configuration",
                  "Update load balancer configuration",
                  "Register with service discovery",
                  "Test and verify"
                ]
              },
              "scaling_services": {
                "description": "Scale services horizontally",
                "command": "docker-compose -f /opt/ai-q/docker/compose/ai-q-stack.yml up -d --scale redis-slave=3"
              },
              "security_updates": {
                "description": "Perform security updates",
                "steps": [
                  "Update firewall rules",
                  "Run security compliance check",
                  "Update SSL certificates",
                  "Review access logs"
                ]
              },
              "performance_tuning": {
                "description": "Optimize system performance",
                "steps": [
                  "Monitor resource usage",
                  "Adjust resource limits",
                  "Optimize configuration",
                  "Run performance tests"
                ]
              }
            },
            "troubleshooting": {
              "service_wont_start": {
                "description": "Troubleshoot service startup issues",
                "steps": [
                  "Check Docker logs: docker logs <service-name>",
                  "Verify configuration files",
                  "Check resource availability",
                  "Review dependency status"
                ]
              },
              "high_resource_usage": {
                "description": "Address high resource consumption",
                "steps": [
                  "Check system metrics in Grafana",
                  "Identify resource-intensive processes",
                  "Optimize configuration",
                  "Scale services if needed"
                ]
              },
              "network_issues": {
                "description": "Resolve network connectivity problems",
                "steps": [
                  "Check firewall rules",
                  "Verify network connectivity",
                  "Test service discovery",
                  "Review load balancer configuration"
                ]
              }
            },
            "maintenance_schedule": {
              "daily": [
                "Health checks",
                "Backup verification"
              ],
              "weekly": [
                "Security updates",
                "Performance review"
              ],
              "monthly": [
                "Full system audit",
                "Documentation updates"
              ]
            },
            "emergency_procedures": {
              "system_failure": "Use disaster recovery procedures",
              "data_loss": "Restore from latest backup",
              "security_breach": "Follow incident response plan",
              "performance_issues": "Implement performance optimization"
            },
            "contact_information": {
              "primary_admin": "admin@ai-q.local",
              "backup_admin": "backup-admin@ai-q.local",
              "emergency": "+1-555-0123"
            }
          }
        },
        "commands": [
          "sudo tee /opt/ai-q/documentation/administration-guide.json << 'EOF'\n{\n  \"administration_guide\": {\n    \"title\": \"AI-Q Administration Guide\",\n    \"version\": \"1.0.0\",\n    \"quick_start\": {\n      \"system_status_check\": {\n        \"description\": \"Check system health and service status\",\n        \"commands\": [\n          \"docker ps\",\n          \"curl http://localhost:8500/v1/status/leader\",\n          \"curl http://localhost:9090/-/healthy\"\n        ]\n      },\n      \"service_management\": {\n        \"description\": \"Manage system services\",\n        \"commands\": {\n          \"start_all_services\": \"docker-compose -f /opt/ai-q/docker/compose/ai-q-stack.yml up -d\",\n          \"stop_all_services\": \"docker-compose -f /opt/ai-q/docker/compose/ai-q-stack.yml down\",\n          \"restart_specific_service\": \"docker restart ai-q-postgresql\"\n        }\n      },\n      \"backup_operations\": {\n        \"description\": \"Backup and recovery operations\",\n        \"commands\": {\n          \"create_backup\": \"/opt/ai-q/backup/scripts/backup-all.sh\",\n          \"list_backups\": \"ls -la /opt/ai-q/backup/data/\",\n          \"restore_backup\": \"/opt/ai-q/backup/scripts/recover-all.sh <backup-name>\"\n        }\n      },\n      \"monitoring_access\": {\n        \"description\": \"Access monitoring interfaces\",\n        \"urls\": {\n          \"grafana\": \"http://localhost:3000\",\n          \"prometheus\": \"http://localhost:9090\",\n          \"kibana\": \"http://localhost:5601\",\n          \"consul\": \"http://localhost:8500\",\n          \"rabbitmq\": \"http://localhost:15672\"\n        }\n      }\n    },\n    \"common_operations\": {\n      \"adding_new_service\": {\n        \"description\": \"Add new service to the system\",\n        \"steps\": [\n          \"Create Docker Compose service definition\",\n          \"Add to monitoring configuration\",\n          \"Update load balancer configuration\",\n          \"Register with service discovery\",\n          \"Test and verify\"\n        ]\n      },\n      \"scaling_services\": {\n        \"description\": \"Scale services horizontally\",\n        \"command\": \"docker-compose -f /opt/ai-q/docker/compose/ai-q-stack.yml up -d --scale redis-slave=3\"\n      },\n      \"security_updates\": {\n        \"description\": \"Perform security updates\",\n        \"steps\": [\n          \"Update firewall rules\",\n          \"Run security compliance check\",\n          \"Update SSL certificates\",\n          \"Review access logs\"\n        ]\n      },\n      \"performance_tuning\": {\n        \"description\": \"Optimize system performance\",\n        \"steps\": [\n          \"Monitor resource usage\",\n          \"Adjust resource limits\",\n          \"Optimize configuration\",\n          \"Run performance tests\"\n        ]\n      }\n    },\n    \"troubleshooting\": {\n      \"service_wont_start\": {\n        \"description\": \"Troubleshoot service startup issues\",\n        \"steps\": [\n          \"Check Docker logs: docker logs <service-name>\",\n          \"Verify configuration files\",\n          \"Check resource availability\",\n          \"Review dependency status\"\n        ]\n      },\n      \"high_resource_usage\": {\n        \"description\": \"Address high resource consumption\",\n        \"steps\": [\n          \"Check system metrics in Grafana\",\n          \"Identify resource-intensive processes\",\n          \"Optimize configuration\",\n          \"Scale services if needed\"\n        ]\n      },\n      \"network_issues\": {\n        \"description\": \"Resolve network connectivity problems\",\n        \"steps\": [\n          \"Check firewall rules\",\n          \"Verify network connectivity\",\n          \"Test service discovery\",\n          \"Review load balancer configuration\"\n        ]\n      }\n    },\n    \"maintenance_schedule\": {\n      \"daily\": [\"Health checks\", \"Backup verification\"],\n      \"weekly\": [\"Security updates\", \"Performance review\"],\n      \"monthly\": [\"Full system audit\", \"Documentation updates\"]\n    },\n    \"emergency_procedures\": {\n      \"system_failure\": \"Use disaster recovery procedures\",\n      \"data_loss\": \"Restore from latest backup\",\n      \"security_breach\": \"Follow incident response plan\",\n      \"performance_issues\": \"Implement performance optimization\"\n    },\n    \"contact_information\": {\n      \"primary_admin\": \"admin@ai-q.local\",\n      \"backup_admin\": \"backup-admin@ai-q.local\",\n      \"emergency\": \"+1-555-0123\"\n    }\n  }\n}\nEOF"
        ],
        "verification": "Check administration guide exists",
        "expected_output": "administration-guide.json created with comprehensive guide"
      }
    ],
    "verification_commands": [
      "cat /opt/ai-q/documentation/administration-guide.json"
    ],
    "expected_outputs": {
      "admin_guide": "administration-guide.json contains comprehensive administration guide"
    }
  },
  "task_03_create_handover_documentation": {
    "task_id": "01-12-03",
    "title": "Create Handover Documentation",
    "description": "Create comprehensive handover documentation",
    "estimated_duration": "30 minutes",
    "critical": true,
    "steps": [
      {
        "step_id": "01-12-03-01",
        "title": "Create handover checklist",
        "description": "Create comprehensive handover checklist",
        "config_file": "/opt/ai-q/documentation/handover-checklist.json",
        "config_content": {
          "handover_checklist": {
            "title": "AI-Q System Handover Checklist",
            "version": "1.0.0",
            "pre_handover_verification": {
              "system_health_check": {
                "description": "Verify all system components are operational",
                "checks": [
                  "All services running: docker ps",
                  "Service discovery healthy: curl http://localhost:8500/v1/status/leader",
                  "Monitoring operational: curl http://localhost:9090/-/healthy",
                  "Load balancer responding: curl http://localhost:80",
                  "Database accessible: docker exec ai-q-postgresql pg_isready",
                  "Cache operational: docker exec ai-q-redis-master redis-cli ping"
                ]
              },
              "backup_verification": {
                "description": "Verify backup system is functional",
                "checks": [
                  "Latest backup exists: ls -la /opt/ai-q/backup/data/",
                  "Backup integrity verified: /opt/ai-q/backup/scripts/backup-all.sh",
                  "Recovery test completed: Recovery procedure tested",
                  "Backup automation working: Cron jobs configured"
                ]
              },
              "security_verification": {
                "description": "Verify security measures are in place",
                "checks": [
                  "Firewall active: ufw status",
                  "Security compliance: /opt/ai-q/security/compliance/check-compliance.sh",
                  "Access controls configured: Authentication working",
                  "SSL certificates valid: HTTPS accessible"
                ]
              },
              "performance_verification": {
                "description": "Verify system performance is optimized",
                "checks": [
                  "Resource limits applied: ulimit -n",
                  "Performance monitoring: /opt/ai-q/performance/monitor-performance.sh",
                  "System optimization: Performance tuning applied",
                  "Load testing completed: System handles expected load"
                ]
              },
              "documentation_verification": {
                "description": "Verify all documentation is complete",
                "checks": [
                  "System documentation complete: All guides created",
                  "Configuration documented: All configs explained",
                  "Procedures documented: All procedures written",
                  "Troubleshooting guide: Common issues covered"
                ]
              }
            },
            "handover_items": {
              "access_credentials": {
                "description": "Transfer access credentials",
                "items": [
                  "SSH access provided",
                  "Admin user accounts created",
                  "Service passwords documented",
                  "API keys provided",
                  "SSL certificates transferred"
                ]
              },
              "configuration_files": {
                "description": "Transfer configuration files",
                "items": [
                  "All configs in /opt/ai-q/",
                  "Docker Compose files",
                  "Service configurations",
                  "Monitoring configs",
                  "Security policies"
                ]
              },
              "scripts_and_tools": {
                "description": "Transfer scripts and tools",
                "items": [
                  "Backup scripts: /opt/ai-q/backup/scripts/",
                  "Recovery scripts: /opt/ai-q/disaster-recovery/",
                  "Monitoring scripts: /opt/ai-q/performance/",
                  "Security scripts: /opt/ai-q/security/"
                ]
              },
              "monitoring_access": {
                "description": "Provide monitoring access",
                "urls": {
                  "grafana": "http://localhost:3000",
                  "prometheus": "http://localhost:9090",
                  "kibana": "http://localhost:5601",
                  "consul": "http://localhost:8500",
                  "rabbitmq": "http://localhost:15672"
                }
              }
            },
            "post_handover_tasks": {
              "training_completed": {
                "description": "Complete training requirements",
                "items": [
                  "System overview presented",
                  "Common operations demonstrated",
                  "Troubleshooting procedures explained",
                  "Emergency procedures reviewed"
                ]
              },
              "contact_information": {
                "description": "Provide contact information",
                "items": [
                  "Primary admin contact provided",
                  "Backup admin contact provided",
                  "Emergency contact provided",
                  "Support escalation path documented"
                ]
              },
              "maintenance_schedule": {
                "description": "Establish maintenance schedule",
                "items": [
                  "Daily tasks explained",
                  "Weekly tasks scheduled",
                  "Monthly tasks planned",
                  "Emergency procedures documented"
                ]
              }
            },
            "sign_off": {
              "system_administrator": "_________________",
              "handover_recipient": "_________________",
              "date": "_________________",
              "notes": "_________________"
            },
            "follow_up": {
              "description": "Schedule follow-up reviews",
              "reviews": [
                "1-week review scheduled",
                "1-month review scheduled",
                "3-month review scheduled",
                "Annual review scheduled"
              ]
            }
          }
        },
        "commands": [
          "sudo tee /opt/ai-q/documentation/handover-checklist.json << 'EOF'\n{\n  \"handover_checklist\": {\n    \"title\": \"AI-Q System Handover Checklist\",\n    \"version\": \"1.0.0\",\n    \"pre_handover_verification\": {\n      \"system_health_check\": {\n        \"description\": \"Verify all system components are operational\",\n        \"checks\": [\n          \"All services running: docker ps\",\n          \"Service discovery healthy: curl http://localhost:8500/v1/status/leader\",\n          \"Monitoring operational: curl http://localhost:9090/-/healthy\",\n          \"Load balancer responding: curl http://localhost:80\",\n          \"Database accessible: docker exec ai-q-postgresql pg_isready\",\n          \"Cache operational: docker exec ai-q-redis-master redis-cli ping\"\n        ]\n      },\n      \"backup_verification\": {\n        \"description\": \"Verify backup system is functional\",\n        \"checks\": [\n          \"Latest backup exists: ls -la /opt/ai-q/backup/data/\",\n          \"Backup integrity verified: /opt/ai-q/backup/scripts/backup-all.sh\",\n          \"Recovery test completed: Recovery procedure tested\",\n          \"Backup automation working: Cron jobs configured\"\n        ]\n      },\n      \"security_verification\": {\n        \"description\": \"Verify security measures are in place\",\n        \"checks\": [\n          \"Firewall active: ufw status\",\n          \"Security compliance: /opt/ai-q/security/compliance/check-compliance.sh\",\n          \"Access controls configured: Authentication working\",\n          \"SSL certificates valid: HTTPS accessible\"\n        ]\n      },\n      \"performance_verification\": {\n        \"description\": \"Verify system performance is optimized\",\n        \"checks\": [\n          \"Resource limits applied: ulimit -n\",\n          \"Performance monitoring: /opt/ai-q/performance/monitor-performance.sh\",\n          \"System optimization: Performance tuning applied\",\n          \"Load testing completed: System handles expected load\"\n        ]\n      },\n      \"documentation_verification\": {\n        \"description\": \"Verify all documentation is complete\",\n        \"checks\": [\n          \"System documentation complete: All guides created\",\n          \"Configuration documented: All configs explained\",\n          \"Procedures documented: All procedures written\",\n          \"Troubleshooting guide: Common issues covered\"\n        ]\n      }\n    },\n    \"handover_items\": {\n      \"access_credentials\": {\n        \"description\": \"Transfer access credentials\",\n        \"items\": [\n          \"SSH access provided\",\n          \"Admin user accounts created\",\n          \"Service passwords documented\",\n          \"API keys provided\",\n          \"SSL certificates transferred\"\n        ]\n      },\n      \"configuration_files\": {\n        \"description\": \"Transfer configuration files\",\n        \"items\": [\n          \"All configs in /opt/ai-q/\",\n          \"Docker Compose files\",\n          \"Service configurations\",\n          \"Monitoring configs\",\n          \"Security policies\"\n        ]\n      },\n      \"scripts_and_tools\": {\n        \"description\": \"Transfer scripts and tools\",\n        \"items\": [\n          \"Backup scripts: /opt/ai-q/backup/scripts/\",\n          \"Recovery scripts: /opt/ai-q/disaster-recovery/\",\n          \"Monitoring scripts: /opt/ai-q/performance/\",\n          \"Security scripts: /opt/ai-q/security/\"\n        ]\n      },\n      \"monitoring_access\": {\n        \"description\": \"Provide monitoring access\",\n        \"urls\": {\n          \"grafana\": \"http://localhost:3000\",\n          \"prometheus\": \"http://localhost:9090\",\n          \"kibana\": \"http://localhost:5601\",\n          \"consul\": \"http://localhost:8500\",\n          \"rabbitmq\": \"http://localhost:15672\"\n        }\n      }\n    },\n    \"post_handover_tasks\": {\n      \"training_completed\": {\n        \"description\": \"Complete training requirements\",\n        \"items\": [\n          \"System overview presented\",\n          \"Common operations demonstrated\",\n          \"Troubleshooting procedures explained\",\n          \"Emergency procedures reviewed\"\n        ]\n      },\n      \"contact_information\": {\n        \"description\": \"Provide contact information\",\n        \"items\": [\n          \"Primary admin contact provided\",\n          \"Backup admin contact provided\",\n          \"Emergency contact provided\",\n          \"Support escalation path documented\"\n        ]\n      },\n      \"maintenance_schedule\": {\n        \"description\": \"Establish maintenance schedule\",\n        \"items\": [\n          \"Daily tasks explained\",\n          \"Weekly tasks scheduled\",\n          \"Monthly tasks planned\",\n          \"Emergency procedures documented\"\n        ]\n      }\n    },\n    \"sign_off\": {\n      \"system_administrator\": \"_________________\",\n      \"handover_recipient\": \"_________________\",\n      \"date\": \"_________________\",\n      \"notes\": \"_________________\"\n    },\n    \"follow_up\": {\n      \"description\": \"Schedule follow-up reviews\",\n      \"reviews\": [\n        \"1-week review scheduled\",\n        \"1-month review scheduled\",\n        \"3-month review scheduled\",\n        \"Annual review scheduled\"\n      ]\n    }\n  }\n}\nEOF"
        ],
        "verification": "Check handover checklist exists",
        "expected_output": "handover-checklist.json created with comprehensive checklist"
      }
    ],
    "verification_commands": [
      "cat /opt/ai-q/documentation/handover-checklist.json"
    ],
    "expected_outputs": {
      "handover_checklist": "handover-checklist.json contains comprehensive handover checklist"
    }
  },
  "verification_and_testing": {
    "comprehensive_test": {
      "title": "Complete Documentation and Handover Verification",
      "description": "Run comprehensive tests to verify documentation and handover",
      "test_commands": [
        "ls -la /opt/ai-q/documentation/",
        "cat /opt/ai-q/documentation/system-overview.json",
        "cat /opt/ai-q/documentation/administration-guide.json",
        "cat /opt/ai-q/documentation/handover-checklist.json",
        "echo \"Documentation and handover completed successfully\""
      ],
      "expected_results": {
        "system_docs": "System documentation exists and is complete",
        "admin_guide": "Administration guide exists and is comprehensive",
        "handover_checklist": "Handover checklist exists and is detailed",
        "documentation_complete": "All documentation completed successfully"
      }
    }
  },
  "next_steps": {
    "next_recipe": "02-application-services",
    "prerequisites_completed": [
      "System documentation created and comprehensive",
      "User guides created and detailed",
      "Handover documentation completed",
      "Documentation testing completed",
      "All documentation verified",
      "Core infrastructure recipe complete"
    ],
    "readiness_check": "All verification commands pass successfully",
    "completion_status": "01-core-infrastructure recipe fully implemented and documented"
  },
  "steps": [
    {
      "step_id": "STEP-01",
      "description": "Default step - needs implementation",
      "command": "echo 'Step needs implementation'",
      "expected_output": "Step completed",
      "error_handling": "Continue on error"
    }
  ],
  "inputs": {
    "default_input": {
      "type": "string",
      "required": false,
      "default": "default_value",
      "description": "Default input parameter"
    }
  },
  "outputs": {
    "default_output": {
      "type": "string",
      "description": "Default output parameter"
    }
  },
  "metadata": {
    "title": "01-12-Documentation-And-Handover",
    "version": "1.0.0",
    "creation_timestamp": "2025-07-07T05:00:00Z",
    "last_updated": "2025-07-07T05:00:00Z"
  }
}